event-href,organizer_link,organizer_link-href,full_description
https://www.eventbrite.com/e/nurture-in-nature-retreat-tickets-637353731167?aff=ebdssbdestsearch,The Cognitive Clinic,https://www.eventbrite.com/o/the-cognitive-clinic-14500994351,"There is power in owning our stories. It helps us recognize and manage our emotions when we put them in the context of our stories. It empowers us to make changes in how we show up in the world. The program for the day includes a range of activities designed to help you connect to yourself and your story so that you can begin to heal. For details about these activities, please see the agenda above. We will be sitting on the floor during the retreat.  Tables and chairs will NOT be set up. We encourage you to bring items that will help you feel more comfortable. Such items may include a yoga mat, pillows, blankets, tuffs, slippers, etc.  If you require a different type of seating such as a chair due to a disability or injury, we can provide a basic banquet chair. If you are able to bring a more comfortable chair, we would encourage that.For attendees that are licensed counselors and social workers, CEs will also be available the day of the retreat.This retreat is a joint effort of The Cognitive Clinic and Hope Enrichment Center."
https://www.eventbrite.com/e/40-hour-hazwoper-training-in-chicago-il-wood-dale-tickets-626571370837?aff=ebdssbdestsearch,"Compliance Solutions Occupational Trainers, Inc.",https://www.eventbrite.com/o/compliance-solutions-occupational-trainers-inc-61045768933,"Compliance Solutions, the nation's largest provider of OSHA HAZWOPER Training, is pleased to offer open enrollment for 40-Hour OSHA HAZWOPER Site Worker training in 50+ U.S. cities-Nine different cities every week!Our instructor-led seminars meet or exceed OSHA’s suggested training curricula and meet OSHA’s mandated training requirements under 29 CFR 1910.120(e and q) including hands-on training!Compliance Solutions is the largest private provider of HAZWOPER and DOT Hazmat Training nationally and has earned the trust of the industry by providing quality training since 1995Who needs 40 Hour HAZWOPER Training?40-Hour HAZWOPER training is mandated for employees who have responsibilities to remediate (clean up) hazardous materials at controlled and uncontrolled sites with hazards or work activities that present an Immediate Danger to Life or Health (IDLH). This includes clean-up operations, emergency response operations, storage, disposal, or treatment of hazardous materials and hazardous waste sites. 40-Hour HAZWOPER training is also required prior to OSHA Site-Supervisor training.What is 40 Hour HAZWOPER Training?The 40-Hour HAZWOPER course provides structured classroom training mandated by 29 CFR1910.120 (e and q) including student exercises and a hands-on dress-out to acclimate workers with required Personal Protective Equipment (PPE). Workers attending this instructor-led course will cover 18 different OSHA-suggested topics including health and safety procedures, PPE used during work operations at hazardous material sites, medical monitoring, and many others.Instructors emphasize a practical approach to worksite health and safety, as such, attendees learn to recognize site hazards and take appropriate steps to prevent illness or injuries while on the job site.Register Early! Pre-registration for all classes is required (no walk-in’s) and classes do fill up quickly.Registration Note: This event does NOT issue paper tickets. After registration, you will receive an email confirmation from Compliance Solutions that includes the date, time, and location of the class. Prior to registering read a copy of our cancellation and refund policy. Once registered, you acknowledge you have read and agree to be bound by this policy.Group DiscountsOffered for registrations of the same course type, date, and city. To receive a group discount all students MUST register at the same time:5 to 9 students= 10% 10 or more = 15%For Multiple purchase discounts or onsite Group pricing, call 800-711-2706 Ext 1"
https://www.eventbrite.com/e/16th-annual-burn-awareness-golf-outing-tickets-541538986687?aff=ebdssbdestsearch,Phoenix Society for Burn Survivors,https://www.eventbrite.com/o/phoenix-society-for-burn-survivors-18728231315,"Do you care about burn survivors? Do you love golf? If you answered yes to either question, we want to see you at our 16th annual Burn Awareness Golf Outing this summer!We are burn survivors and friends who are passionate about golf and supporting other burn survivors on their healing journey. After meeting through the Phoenix SOAR (Survivors Offering Assistance in Recovery) peer support program years ago, we combined our two passions to start the Burn Awareness Golf Outing.We are thrilled to be back and celebrating the 16th anniversary of our golf outing! And we are just as excited to announce that 100% of this year’s proceeds will benefit the organization that brought us together— Phoenix Society for Burn Survivors. S﻿chedule of Events11 am Registration Opens12:30 pm Group photo1 pm Shotgun start6 pm Dinner buffet, awards, prizes, silent auctionA﻿bout The EventEach year, in the United States alone, nearly half a million people require medical treatment for a burn injury. Phoenix Society is uniting the voice of the burn community around the globe to profoundly advance lifelong healing, optimal recovery, and burn prevention. As survivors who have personally experienced the power of their programs, we are honored to support their mission. And we hope you will support this event through sponsorship and registration.This year’s event will be bigger and better than ever because we recognize Jamie’s 20th burnaversary and achievement of being awarded the PGA of America’s Deacon Palmer Award! The award honors a PGA Professional who displays outstanding integrity, character, and leadership in the effort to overcome a major obstacle in their life. It’s going to be an incredible day, benefiting an incredible cause. You won’t want to miss it!Join us in person and golf in support of burn survivors everywhere. Your generosity will provide programs that help connect burn survivors and their families with the resources, support, and community that can transform their lives. T﻿ravelG﻿olf CourseThe Preserve at Oak Meadows 900 North Wood Dale Road, Addison, IL 60101A﻿irportO'Hare International Airport10000 W O'Hare Ave, Chicago, IL 60666Neaby H﻿otel Courtyard Chicago Wood Dale/Itasca900 N. Wood Dale Road, Wood Dale, Illinois 60191"
https://www.eventbrite.com/e/8-hour-hazwoper-refresher-training-in-chicago-il-wood-dale-tickets-627257793947?aff=ebdssbdestsearch,"Compliance Solutions Occupational Trainers, Inc.",https://www.eventbrite.com/o/compliance-solutions-occupational-trainers-inc-61045768933,"Compliance Solutions, the nation's largest provider of OSHA, DOT, EPA, and RCRA Training is pleased to offer open enrollment for our 8-Hour OSHA HAZWOPER Annual Refresher training. Classes are delivered in 50+ U.S cities -Nine different cities every week!Our instructor-led seminars meet or exceed OSHA’s suggested training curricula and meet OSHA’s mandated training requirements under 29 CFR 1910.120(e and q).8 Hour HAZWOPER (HAZWOPER Refresher)The 8-Hour HAZWOPER course meets OSHA’s annual refresher requirements for employees who have completed their initial 24-Hour 40-Hour HAZWOPER certification. Mandated training can be found in 29 CFR1910.120. Students attending the 8-Hour HAZWOPER are updated on changes in related regulations, participate in multiple class safety activities, complete a mock dress-out and receive instruction in health and safety procedures, and personnel protection during work operations at hazardous material sites. Unlike our competitors, our training content and exercises are updated annually so your employees don’t take the same class over and over again every year!Who needs 8 Hour HAZWOPER Training? Students must have completed an initial 24-Hour or 40-Hour HAZWOPER course and have maintained certification through annual refresher training. If certification has not been refreshed under OSHA guidelines, the 24-Hour or 40 Hour HAZWOPER should be re-taken to maintain certification.Upon successful completion of the course, students will:Understand changes in HAZWOPER/related regulations in the past year.Describe the effects of hazardous materials on people and the environmentIdentify safe methods and work practices.Recognize signs and labels used to alert personnel of dangers involving hazardous materials.Recognize and identify site and personnel hazards.Register Early! Pre-registration for all classes is required (no walk-in’s) and classes do fill up quickly.Registration Note: This event does NOT issue paper tickets. After registration, you will receive an email confirmation from Compliance Solutions that includes the date, time, and location of the class. Prior to registering read a copy of our cancellation and refund policy. Once registered, you acknowledge you have read and agree to be bound by this policy.Group DiscountsOffered for registrations of the same course type, date, and city. To receive a group discount all students MUST register at the same time:5 to 9 students= 10% 10 or more = 15%Call 800-711-2706 Ext 1 to register multiple students or inquire about Group training."
https://www.eventbrite.com/e/24-hour-hazwoper-training-training-in-chicago-il-wood-dale-tickets-626555162357?aff=ebdssbdestsearch,"Compliance Solutions Occupational Trainers, Inc.",https://www.eventbrite.com/o/compliance-solutions-occupational-trainers-inc-61045768933,"Since 1995, Compliance Solutions has become the nation's largest private provider of OSHA HAZWOPER Training classes. Our classes are available in 50+ U.S. cities- nine different cities each week!These highly interactive Instructor-Led training courses meet or exceed OSHA training requirements under 29 CFR 1910.120(e) - HAZWOPER (40, 24, 16 & 8 Hour)Who needs 24 Hour HAZWOPER Training?The 24-Hour HAZWOPER course is designed for workers who are NOT required to deal directly with cleanup (this would generally be described as not working in conditions that require a protection level of “C or above) such as drillers, surveyors, contractors, administrative personnel, drivers, etc. These job titles must be fully trained pursuant to the HAZWOPER standard (29 CFR 1910.120(e)). Workers attending this course cover health and safety procedures during work operations at hazardous material sites.What is 24-Hour HAZWOPER Training?OSHA requires 24 hours of safety training under OSHA 29 CFR1910.120(e) for individuals who work on controlled or uncontrolled hazardous sites. Course ObjectivesThe two main objectives of HAZWOPER training are:•	Control or eliminate the potential hazards and/or losses, and•	Protect the health and safety of workers, the public, and the environment.PER OSHA’s Hazardous Waste Operations and Emergency Response (HAZWOPER) Standard (29 CFR 1910.120), the purpose of this seminar is to ensure awareness and promote safety among employees who may be exposed to hazardous waste and chemical hazards on work-sites. The objective is to ensure that employees operate in the safest possible manner in situations where contact with potentially hazardous materials is likely.At the conclusion of the 24-Hour HAZWOPER course, students will:•	Understand how hazardous materials are handled, identified, and what the human responses to exposure are•	Learn the importance of the Health and Safety Plan (HSP)•	Incorporate the knowledge of what to do in case of site emergencies•	Use appropriate safety methods and work practice controls•	Recognize signs and labels that are used to alert personnel of danger involving hazardous materialImportant Registration Note: All employees who have regular duties related to handling or cleaning up hazardous materials or waste in any of these functions should take the 40-hour HAZWOPER course. The 24-hour course is designed for “Occasional Site Workers” meaning those individuals whose job functions do not include the handling of waste or hazardous materials as an integral part of their job.Act now and buy your ticket today. Classes fill up quickly. Multiple registration discounts (same course, same class) are available. Please call 800-711-2706 for information!Note: This event does NOT issue paper tickets. After registration, you will receive an email confirmation from Compliance Solutions that includes the date, time, and location of the class. Prior to registering read a copy of our cancellation and refund policy. Once registered, you acknowledge you have read and agree to this policy and provisions.Group DiscountsOffered for registrations of the same course type, date, and city. To receive a group discount all students MUST register at the same time:5 to 9 students= 10% 10 or more = 15%"
https://www.eventbrite.com/e/community-sew-cial-help-create-massive-functional-art-installation-tickets-664239497217?aff=ebdssbdestsearch,Nowhere Collective,https://www.eventbrite.com/o/nowhere-collective-56813025693,"The average US citizen throws away 70 pounds of textiles per year! If that stat gives you anxiety, join us for this therapeutic community sew-cial event hosted by the Apparel Industry Board, Inc, Nowhere Collective and Conscious Costume. Together we'll be sewing the largest (as far as we can tell) sun shade sail ever made from 50 pounds of reclaimed sheets and scrap fabric. The massive artistic shade sail will be installed at The Trashy Summer Market on July 15th at KOVAL Distillery. It will serve to educate attendees on the textile waste crisis as well as help showcase creative reuse and reimagining. The installation will also function as a literal shade for the Trash Smashers and upcycling makers participating in this mid-July market. Contributors will be featured on the signage at the event. F﻿ood and beverages will be provided by Nowhere Collective. Fun and merriment is up to you! You can drop in for a little while or stay for the whole thing. There will be plenty to do for all sewing abilities. Kids and adults are welcome."
https://www.eventbrite.com/e/yards-that-work-sustainable-yard-tour-tickets-672777073337?aff=ebdssbdestsearch,Go Green Winnetka,https://www.eventbrite.com/o/go-green-winnetka-17555346191,"Go Green Winnetka is excited to announce its third Yards That Work sustainable yard tour on Sunday, July 23 from 10 am – 2 pm. Our hosts will share their passion, experience, and wisdom—showcasing what works for them—and hopefully will give you ideas about what might work for you to make your own yard more sustainable. They include projects just getting started, areas a few years further along, and a yard 20 years in the making.The Yards That Work tour is a free, self-guided, rain or shine event. Register here to receive the list of addresses a few days prior to the Tour.For more information including specifics about each yard and to download the event program, visit gogreenwinnetka.org."
https://www.eventbrite.com/e/womens-refresh-recharge-snack-talk-and-walk-tickets-640213745547?aff=ebdssbdestsearch,Robena Armia,https://www.eventbrite.com/o/robena-armia-66206603653,"You deserve a break from the hustle and bustle of daily life. So mark your calendars, grab a friend, and join us. Let's laugh, unwind, and support each other as we create lasting memories.We'll meet at the picnic area at 5:30 PM to enjoy delicious snacks and refreshments while socializing. At 7:00 PM, we'll enter the beautiful garden for a leisurely walk and explore the stunning botanic surroundings.This gathering is all about rejuvenation and regaining your energy and focus. You'll feel the positive vibes as we come together to make new connections and engage in uplifting conversations. It's a chance to escape the ordinary and immerse yourself in a serene and empowering atmosphere.Don't miss out on this opportunity to refresh and recharge at the Women's Refresh & Recharge event. It's time to take care of yourself and embrace the beauty of life."
https://www.eventbrite.com/e/back-yard-composting-brunch-included-tickets-638244465377?aff=ebdssbdestsearch,From Hood To Table,https://www.eventbrite.com/o/from-hood-to-table-66049511653,"Come enjoy your morning with good food, followed by a Urban Farm Tour. Our main focus will be about Backyard Composting! We will cover what makes compost as well as the do’s and dont’s. This will be a great learning event."
https://www.eventbrite.com/e/glory-sonrays-women-empowerment-ministries-4th-anniversary-tickets-662628588947?aff=ebdssbdestsearch,,,"Glory Sonrays Women Empowerment Ministries is celebrating its fourth year of ministry on Saturday, July 15, 2023, at 2:00pm. Join the women of Glory Sonrays for a time of empowerment and fellowship in the picnic area behind Hyde Park High School in Chicago, Illinois."
https://www.eventbrite.com/e/driven-women-create-a-body-as-strong-as-your-spirit-naperville-tickets-389860281597?aff=ebdssbdestsearch,Hard Work is Sexy LLC,https://www.eventbrite.com/o/hard-work-is-sexy-llc-50514995943,"After a year of doing what many have called ""the best kept secret,""  It's time to let you in on a TOTAL LIFE CHANGER.This is a 3 Day Workshop designed to teach you how to get the body you've been wanting without...Killing yourself with Intense Cardio methods that aren't  Sustainable nor enjoyable.Restricting yourself from foods that make you happy & eating foods that you don't even like. Obsessing about the numbers on the scale & dreading looking at yourself without clothes on.  Losing sleep over looming health issues & procrastinating about  dealing with them. My Name is Ramell.I'm a Former Pro Basketball Player, and a current Certified Fitness and Nutrition Specialist. I have a passion for helping Professional Women because they are so Selfless, always giving themselves to their loved ones & colleagues, & sometimes they need to be reminded just how it feels to show up for themselves. It brings me great satisfaction to help women  reach their potential peak and unlock the person inside of you that is dying to come out and say hi. All It takes CONSISTENCY, SUSTAINABILITY, ACCOUNTABILITY AND RECOVERY. I know that it’s not easy, butI'm here to show you how get it done!The Best Investments you can make for your career and your family is to improve your Health & Happiness. Visit www.HardWorkIsSexy.com for more infoWORKSHOP ITINERARYDay 1: Introductions & Routine Building & Gradual Consistency vs. IntensityBuilding an Eco-System around your crazy-ass lifestyle. Tortoise is still undefeated against the HareDay 2: Accountant of Self - 3 accounts that should be funded daily! Ok, Bank is one of them.Day 3: Sustaining & Maintaining & Importance of Recovery - All that sweat, energy & motivation lost...  get it back & do it again."
https://www.eventbrite.com/e/a-space-of-rest-and-reflection-curated-by-ciera-mckissick-tickets-664808469027?aff=ebdssbdestsearch,Logan Center for the Arts,https://www.eventbrite.com/o/logan-center-for-the-arts-26846671357,"A Space of Rest and Reflection curated by Ciera McKissick | Pop-Up InstallationMon, Jul 10-Fri, Aug 4 / Level 2  South Cantilever LoungeInspired by our summer-long celebration of light and connection along with the themes found in Tricia Hersey’s Rest is Resistance: A Manifesto, Ciera McKissack will create a space open to all of our communities. If you are looking for a place to read, reflect, rest, and restore, please visit this space."
https://www.eventbrite.com/e/compost-for-life-with-internationally-recognized-urban-farmer-will-allen-tickets-670710783007?aff=ebdssbdestsearch,Urban Growers Collective,https://www.eventbrite.com/o/urban-growers-collective-46492705633,"Join internationally recognized urban farmer, Will Allen, for a compost and vermicompost basics immersion workshop followed by a Q&A on best practices from one of our revered elders.Will Allen is the founder of Growing Power, the original organization behind what is now Urban Growers Collective, and father to one of our co-founders, Erika Allen. He is traveling from his home in Milwaukee to bring you a hands-on educational workshop on the secret behind his success: urban-composting, using the compost systems at our South Chicago Farm as an active demonstration.D﻿id you know that food waste in America accounts for nearly 10% of our methane emissions? By rerouting your food waste from the trash can to the compost pile you can turn your trash into the building-blocks of life and heal the planet, rather than harm it.W﻿e are asking for support-offerings of $25 per participant for those who are able. Bring your own kitchen scraps to ""donate"" to our compost pile!S﻿ee you there!"
