event-href,organizer_link,organizer_link-href,full_description
https://www.eventbrite.com/e/the-truth-is-out-there-the-impact-of-science-disinformation-tickets-665707397747?aff=ebdssbdestsearch,The Chicago Council on Science and Technology,https://www.eventbrite.com/o/the-chicago-council-on-science-and-technology-13227910713,"Are you experiencing information overload? Increase awareness and confidence in knowing types of communication and becoming allies in propagating ACCURATE information. Empower yourself, bring friends and neighbors, and register NOW to attend this FREE workshop appropriate for ages 12+. *Please bring a SMART deviceSchedule of Events:Check-in, Coffee, & Chit Chat - All (8:15 - 9:00 am) Welcome - Thomas Alaan, University of Illinois Chicago (9:00 - 9:05 am) Introduction - Overcoming Persistent Misinformation  - Ashley Anderson, Colorado State University (9:05-9:15 am)Misinformation is sticky, even in the face of correction. A brief review of cognitive theories sheds light on the reasons why inaccurate information persists. A discussion of current practices in public health and emergency management provides insight into why relational approaches built on dialogue and trust are effective in addressing misinformation.Keynote - Old Tricks, New Tools: Three Keys to Freedom from Division & Deception - Sabrina Joy Stevens (9:15-9:35 am)Information disorder - the toxic mix of misinformation, disinformation, and malinformation bad actors use to pollute our collective thinking around important social, economic, and political matters — has become a hot topic in recent years, and for a good reason. Virtually all of us have fallen prey to its deceptive, divisive effects in some aspect of our lives and have felt its consequences in our relationships and other issues that affect our shared quality of life. So how can we protect ourselves, our communities, and our causes from the insidious effects of hate and deception? In this funny, practical talk, longtime civil rights activist and communications strategist Sabrina Joy Stevens exposes the age-old political manipulation tactics at the root of what social scientists now call information disorder. Relying on both personal experience and robust research, she breaks down how bad actors mislead the rest of us into hate and self-sabotage for their own political and economic gain. She also reveals how love, humility, and courage can help us outsmart this kind of manipulation. While the scale of this problem has certainly increased with the advent of new technologies, information disorder is actually a very old, very familiar problem. With the right mindsets and habits, we can come together to make mass deception a thing of the past instead of letting it define our future. Panel Introduction - Jocelyn Leitzinger, University of Illinois Chicago 9:35-9:45 am     Panel: The Disinformation of the Future  (9:45-10:30 am) Sabrina Joy StevensAshley AndersonJocelyn LeitzingerJennifer Choi - ModeratorBreak (10:30 -10:45 am)Workshop - Pipelines of Information - Jocelyn Leitzinger (10:45 -11:40 am)   Conclusion/Call to Action + Networking with appetizers and light refreshments (11:45 am -12:15 pm)             Exit (12:30 pm)                ResourcesClimate Change Disinformation work Merchants of Doubt Official Trailer 1 (2014) - https://www.youtube.com/watch?v=j8ii9zGFDtc&t=8s  Play the Fake News Game → https://www.getbadnews.com/books/english/  Can You Spot the Troll?  https://spotthetroll.org/Angry Uncle Bot https://www.nytimes.com/interactive/2018/11/18/opinion/thanksgiving-family-argue-chat-bot.htmlE﻿vent Details:Friday, July 21st, 2023, 8:30 am - 12:30 pm CT, in person at The University of Illinois at Chicago campus and live streaming TBA!In-person address: The University of Illinois Chicago-Student Center East; Room 605 - 750 South Halsted St. Chicago IL 60607Parking: For all events taking place in Student Center East‚ parking is available in the Halsted and Taylor Street Parking Structure (760 West Taylor Street). The entrance to this parking structure is on Taylor Street. Upon entry‚ guests should take a ticket, and upon exit‚ guests should present this ticket to the cashier and pay the appropriate total (cash‚ debit cards‚ and credit cards are accepted at this lot).Public Transportation: CTA via Blue Line and CTA Buses #7, #8, and #60.  https://www.transitchicago.com/station/uich/#:~:text=UIC%2DHalsted%20Blue%20LineAddress: 430 S. Halsted St., Chicago, IL 60607Type of station: Expressway LineBike parking: Indoor and sheltered bike parking is available.Entry is available from Halsted, Morgan, and Peoria.Notice 1: As a guest of the Chicago Council on Science and Technology (C2ST), you agree to be photographed, videotaped, or filmed and grant C2ST permission to put the finished footage/photography to any uses that it may deem proper, including marketing, advertising (print, radio, and television) and PR-related activities.Notice 2: If you have unsubscribed from Eventbrite emails in the past, your ticketing information may be sent to spam. Please check your spam folder an hour prior to the program, and if your tickets aren't there, reach out (info@c2st.org). Thank you!Featured Speaker: Ashley Anderson, Ph.D. - Associate Professor, Colorado State University, Department of Journalism and Media CommunicationAshley Anderson is a communication scientist who examines how audiences select, interpret, and respond to mediated communication about scientific topics. She collaborates with community organizations to use evidence-based approaches to communicate health and environmental risks such as air quality and wildfire smoke, pandemic disease, and workplace health and safety exposures. Her research also explores how humor, incivility, and sarcasm in digital media conversations engage and divide the public along scientific issues. She is a faculty member in the Center for Science Communication and the Department of Journalism and Media Communication at Colorado State University.Additional informationhttps://www.libarts.colostate.edu/people/aaander/ Featured S﻿peaker:Jocelyn Leitzinger, Ph.D. - Assistant Professor, University of Illinois at Chicago, Department of Managerial StudiesJocelyn Leitzinger is an Assistant Professor at the University of Illinois at Chicago College of Business Administration in the Managerial Studies department. Previously, she was Visiting Assistant Professor at the Kellogg School of Management at Northwestern University. She has also held Postdoctoral Research Fellow positions at McGill University and the University of Michigan, with joint appointments at the Erb Institute, Graham Sustainability Institute, and the U-M Energy Institute.She completed my Ph.D. in Strategic Management and Organizational Theory at the University of Wisconsin, Madison in 2014. I also have a Master's in International Business from the University of Florida, along with Bachelor's degree in Advertising and Marketing.In her free time, she stays active with rock climbing and aerial silks. And I appease my creative side through painting, photography, and cooking. When I get the chance, I enjoy exploring new places  - making sure to get my nature fix whenever possible.  You can see my favorite adventures and creations in the Other Pursuits gallery.Additional informationhttp://www.jocelynleitzinger.com/ https://business.uic.edu/profiles/jocelyn-leitzinger/ Keynote Speaker: Sabrina Joy Stevens - Founder of Sabijoy Creative SolutionsAwakening liberation from the inside out. Sabrina Joy Stevens is a communications strategist who’s an expert on minimizing the power of disinformation. She has contributed to some of the most impactful human and civil rights movements of the last 20 years. As a trainer and consultant, she helps advocates cultivate brave and joyful strategic communications and campaigns for justice. She also teaches people how to use values-driven narrative techniques to neutralize disinformation. Her work has appeared in media outlets, including MSNBC, The Washington Post, Education Week, The Hill, and more.Founder of Sabijoy Creative Solutions, a boutique social change consultancy dedicated to collective liberation. She is an accomplished communications and issue campaign strategist for several of America’s leading labor and civil rights organizations and confronted mis- and disinformation in numerous public policy conversations. Now, as people of all kinds awaken to the do-or-die urgency of overcoming injustice and protecting our planet, sharing insights and expertise across and beyond traditional movement spaces to give more people the tools to transform our lives and communities. Sabijoy Creative Solutions exists to help advocates craft brave, joyful, effective communications and campaigns for justice. You can click here to learn more about her background and approach or explore other ways to collaborate below. Sabrina Joy Stevens is a teacher, writer, and activist who has worked with students in struggling communities in Philadelphia and Denver.Additional informationhttps://www.sabrinajoystevens.com/ Moderator for the Panel: Jennifer Choi -  Senior Director of Strategic Planning and Special Projects at Chicago Public MediaJennifer Choi is the Senior Director of Strategic Planning and Special Projects at Chicago Public Media. Previously, she was the director of programs at Media Democracy Fund (MDF), a funding intermediary that advances public interest technology. There, she developed and launched the Digital Equity and Opportunity Initiative, a $2.5M pooled fund of national foundations to sustainably address the digital divide in communities of color across the South. Jenny additionally developed and managed a cohort of foundation funders interested in finance-focused strategies utilizing a tech lens and a Global South Platform Accountability Network.Prior to MDF, she was the director of equity initiatives at the Craig Newmark Graduate School of Journalism (CUNY), working collaboratively with departments across the Newmark J-School to promote equity and implement best practices related to diversity, equity, and inclusion, including providing change management strategies to newsrooms promoting best DEI practices. There, she additionally served as managing director of the News Integrity Initiative, a funding intermediary housed at the School to strengthen trust between newsrooms and communities.Before she joined the Newmark J-School, Jennifer was vice president and chief content officer for the National Committee for Responsive Philanthropy,  a research organization for social justice philanthropy; managed the journalism portfolio of grants at the Robert R. McCormick Foundation, where she seeded organizations such as the City Bureau and Obsidian Collection, and served as director of strategic initiatives at Chicago Public Media.This program is presented in partnership with:This program is graciously sponsored by:"
https://www.eventbrite.com/e/the-eco-friendly-sustainable-show-chicago-fashion-week-powered-by-fbc-tickets-667662896697?aff=ebdssbdestsearch,FashionBar Chicago,https://www.eventbrite.com/o/fashionbar-chicago-3222454378,"Fashion Designer garment on Invite By FashionBar SustainableFashionBar is excited to announce our Eco-Friendly & Sustainable Show in partnership with  The Aids Healthcare Foundation (AHF). AHF is a global nonprofit organization providing cutting-edge medicine and advocacy to over 1,700,000 people in 45 countries.Explore the harmonious blend of style and sustainability as designers present their ethical and eco-friendly collections. Experience a showcase of innovative designs that prioritize the well-being of the planet. Get inspired by the latest trends in eco-conscious fashion during this inspiring event.FashionBar invites you to join us as VIPS on the red carpet. Experience Chicago Fashion Week powered by FashionBar as you meet and greet fashion designers showcasing at The Shows at Water Tower Place on Chicago’s Magnificent Mile!Event Itinerary:Doors open at 12:00 pmCocktail Reception opens at 12:30pmPerformance To be announced 1:00pm Showcasing Brand  begins at 1:15pm CLOSE at 3:00pmAttend The Shows and shop The Marketplace and celebrate Chicago Fashion Week powered by FashionBar.See you at The Shows!Contact Us:Media/Sponsors/Vendors or general questions and requests, please  email fashionweek@fashionbarchicago.com  or visit us at www.fashionbarchicago.com or call us at 312-532-4210.FashionBar LLC, Water Tower Place (Level 3)835 North Michigan AvenueChicago, IL 60611Chicago Fashion Week powered by FashionBarInstagram: @ChicagosFashionbarWeek, #ChicagosFashionWeekFacebook: @chicagosfashionweek, Twitter: @ChicagosFashionWeek @AFashionCapital"
https://www.eventbrite.com/e/2023-parliament-of-the-worlds-religions-tickets-637599887427?aff=ebdssbdestsearch,Spiritual Life Center,https://www.eventbrite.com/o/spiritual-life-center-46942351273,"From the Parliament of the World's Religions website: ""In August of 2023, the Parliament of the World’s Religions returns to the birthplace of the modern interfaith movement after 30 years away to celebrate 130 years of history in the city of Chicago. Parliament Convenings attract participants from more than 200 diverse religious, indigenous, and secular beliefs and more than 80 nations.Registrants enjoy access to all the plenary sessions, hundreds of breakout sessions, art & cultural exhibits, performances, a film festival, and countless opportunities to connect with individuals and organizations committed to justice, peace, and sustainability at the world’s largest and most inclusive interfaith conference.The 2023 Parliament of the World’s Religions will be hosted in McCormick Place Lakeside Center (2301 S King Dr, Chicago, IL 60616) from August 14-18, 2023.""This event is the world’s largest, most diverse, and inclusive interfaith convening of people of faith, spirituality, and goodwill. Its origins are rooted in the 1893 World’s Columbian Exposition in Chicago, where the historic first convening of the World Parliament of Religions created a global platform for engagement of religions of the east and west. A﻿nd our very own Rev. James Trapp will be a speaker at this year's event! Stay tuned for complete details on the two sessions he will be speaking in: Global Ethics Symposium and IS RACISM FAKE NEWS?R﻿egistration for this event CANNOT be done through this event listing on Eventbrite. You must get your tickets and hotel registration directly via the Parliament of the World's Religions website here: https://parliamentofreligions.org/I﻿f you decide to give a Love Offering for this Eventbrite listing, it will be considered a donation to Spiritual Life Center and will not contribute in any way to your registration for this event via the Parliament of the World's Religions website.This is a huge event and sometimes people become overwhelmed. To help, Rev. Dave Lyman will host a WOW Wednesday on July 26th called ""How to Attend the Parliament of the World’s Religions Effectively"" so mark your calendars!"
https://www.eventbrite.com/e/driven-women-create-a-body-as-strong-as-your-spirit-chicago-tickets-389863671737?aff=ebdssbdestsearch,Hard Work is Sexy LLC,https://www.eventbrite.com/o/hard-work-is-sexy-llc-50514995943,"After a year of doing what many have called ""the best kept secret,""  It's time to let you in on a TOTAL LIFE CHANGER.This is a 3 Day Workshop designed to teach you how to get the body you've been wanting without...Killing yourself with Intense Cardio methods that aren't  Sustainable nor enjoyable.Restricting yourself from foods that make you happy & eating foods that you don't even like. Obsessing about the numbers on the scale & dreading looking at yourself without clothes on.  Losing sleep over looming health issues & procrastinating about  dealing with them. My Name is Ramell.I'm a Former Pro Basketball Player, and a current Certified Fitness and Nutrition Specialist. I have a passion for helping Professional Women because they are so Selfless, always giving themselves to their loved ones & colleagues, & sometimes they need to be reminded just how it feels to show up for themselves. It brings me great satisfaction to help women  reach their potential peak and unlock the person inside of you that is dying to come out and say hi. All It takes CONSISTENCY, SUSTAINABILITY, ACCOUNTABILITY AND RECOVERY. I know that it’s not easy, butI'm here to show you how get it done!The Best Investments you can make for your career and your family is to improve your Health & Happiness. Visit www.HardWorkIsSexy.com for more infoWORKSHOP ITINERARYDay 1: Introductions & Routine Building & Gradual Consistency vs. IntensityBuilding an Eco-System around your crazy-ass lifestyle. Tortoise is still undefeated against the HareDay 2: Accountant of Self - 3 accounts that should be funded daily! Ok, Bank is one of them.Day 3: Sustaining & Maintaining & Importance of Recovery - All that sweat, energy & motivation lost...  get it back & do it again."
https://www.eventbrite.com/e/solar-business-festival-sbf-2023-chicago-tickets-539220341557?aff=ebdssbdestsearch,GAA Exhibitions & Conferences,https://www.eventbrite.com/o/gaa-exhibitions-amp-conferences-50910716733,"Solar Business Festival (SBF) is a leading solar conference that features a wide variety of sessions on all components of doing a solar and storage business, covering solar project financing, C&I solar projects, energy storage, access to solar, solar jobs, and careers, community solar, rebate programs, policies, and more.From products showcase, project presentations, workshops, and original roundtables, Solar Business Expo is dedicated to:• To provide a significant business platform for connectivity, marketing, and sales• Promote solar business opportunities and solar investment opportunities• Accelerate the financing of priority bankable solar projects• Showcase innovative solar products"
https://www.eventbrite.com/e/one-stop-plant-swap-tickets-672694446197?aff=ebdssbdestsearch,Chicago Fair Trade,https://www.eventbrite.com/o/chicago-fair-trade-7909745334,"The One Stop Plant Swap has everything you need on a Sunday afternoon: beautiful plants, a relaxing river walk, biodiversity galore, and even a DIY spa with fair trade wine!Join us at the Chicago Fair Trade Museum from 1pm to 6pm for a jam-packed afternoon. Come at 1:00 to kick off the plant swap! Bring along any seedlings, plants, and cuttings you want to swap and exchange them with others, all while enjoying some complimentary fair trade coffee and tea. Hear the fascinating story from Chicago Fair Trade business member Earthfoam, an independent, family-owned company making mattresses from tree and sheep to shop and sleep. When Earthfoam first started, they weren’t happy with existing supply chains, so they set out to create their own. They now partner with a Fair For Life-certified network of 323 small organic farms, employing more than 1,700 workers (and counting). CFT board member and WBEZ alum Jerome McDonnell will lead a discussion on native plants and their significance. Did you know that Chicago’s name (supposedly) originates from a native wild onion?CFT member The Eco Flamingo and their partner Innertwine Herbs will be in the house, leading hands-on  eco-activities for kids  (sensory bins and more) and adults (make your own herbal bath soak!)  Enjoy a  DIY spa session. Sit back, relax, and enjoy a variety of fair trade wines, chocolates, and other snacks. (If you’re feeling generous, the suggested donation for the wine bar is $5.)We’ll take a stroll to the Wild Mile, a mile-long stretch of the Chicago River just under ten minutes’ walk from the museum. This renovation project, led by Urban Rivers, seeks to turn this part of Chicago’s industrial corridor into a living, breathing green space.When else will you have the chance to enjoy Chicago’s natural spaces and species while sipping ethically-sourced rose? Don’t miss out - book your tickets now!Please note: As a non-profit, we suggest a $10 donation to take part in the Plant Swap to help us cover the cost of running our event. If you’re feeling extra generous, those who donate $20 or more get to show off a plastic-free swag bag complete with fair trade chocolate!If cost is a barrier for you, please get in touch at info@chicagofairtrade.org to request a comped ticket. All are welcome!Get inspired to green-ify your home with some brand-new plant friendsTake a relaxing walk in Chicago’s Wild Mile!Enjoy a glass of fair trade wine from the La Riojana cooperative in the foothills of ArgentinaTake in the stunning cityscape views from the newly-rewilded river"
https://www.eventbrite.com/e/dreamers-womens-networking-celebration-hybrid-event-tickets-608943716047?aff=ebdssbdestsearch,D.R.E.A.M.E.R.S. Worldwide,https://www.eventbrite.com/o/dreamers-worldwide-11250649094,"LEVEL UP YOUR NETWORKING...LEVEL UP YOUR CONNECTIONS...LEARN THE FORMULA FOR LIFE SUCCESS! If you want to network with positive like-minded women that can add great value as you pursue your goals, then you need to be at this hybrid event! Networking is a key part of the fast track to success!  And now you can make high-quality, professional and life connections in-person or from the comfort of your home. Our events always provide opportunity for attendees to be celebrated for personal achievements and milestones alongside other fun-spirited, positive, like-minded women that are eager to grow together. Women are a necessary contributor to growth when it comes to any area of life. Level up your mindset to creating exponential growth in your business, networking with positive like-minders, having fruitful relationships, peace at home, making self-love your priority and spiritual growth with boldness and confidence!  Our speaker, Yasmine Brown, Co-Founder of D.R.E.A.M.E.R.S. Worldwide, Author of Love: Answers to a New Beginning, Goals Coach, Community Builder & Mompreneur will help you clearly define your Head Crusher Mindset so that you can successfully turn your vision into reality with boldness and confidence. Helping hundreds of women to move outside of their comfort zone to be movers and shakers of today, Yasmine learned that in order to truly live the life you want, no matter what it is, you have to believe, create it for yourself and be UNMESSABLE WITH! That is exactly what she will teach you in-person or while you are cozy at home SO DON'T MISS IT!IN-PERSON EXPERIENCEDelicious  full 3-course meal. Includes choice of salad and vegetarian optionsVendor Tables & Networking with other positive, like-minded women who will support you in every wayBirthday Celebration. Our signature birthday celebrations cheer the day you fabulous ladies were born along with a birthday gift, birthday cake and more!Free giveaways! We have some special goodies to give away to help make your life easierDynamic Panel Discussion on how to break free from self-sabotage and define what having it all means to you by Yasmine Brown and friendsRose Ceremony. Receive your roses while you are here! Let us give you the appreciation you deserveA GREAT and FUN time getting turned up with women who are friendly, energetic, and ready to connect with you! LIVE VIRTUAL EXPERIENCEVirtual networking. We make virtual networking fun, easy, engaging and interactive by leveraging the newest online networking technology. Value Network. We provide a unique breakout  and chat room experience to best serve you in connecting with women who will support you in every wayDynamic Panel Discussion on how to break free from self-sabotage and define what having it all means to you by Yasmine Brown and friendsA GREAT and FUN time getting turned up with women who are friendly, energetic, and ready to connect with you! REWARD RECOGNITION ALERT! We will be recognizing women who reached and surpassed their goals in 2022 and have been rocking out 2023 so far with flowers and Reward certificates, so please let us know your accomplishments. We want to recognize and celebrate you! Many women have connected and formed professional relationships, friendships, and support groups. Others have gained funding, new customers, and so much more at our upscale events while receiving powerful messages from outstanding speakers. These are the women who decided to be at the right place at the right time!We look forward to creating beautiful memories with you!"
