event-href,organizer_link-href,full_description
https://www.eventbrite.com/e/the-hairstylist-hutle-express-color-walnut-creek-ca-080923-tickets-616500318047?aff=ebdssbdestsearch,https://www.eventbrite.com/o/the-network-salon-gina-bianca-education-30942637815,"IMPORTANT: Please note that this class is scheduled on a weekday. We understand that this may require you to adjust your schedule, but we believe it's worth it. Gina Bianca is thrilled to offer education beyond the typical weekend format, so that stylists can spend more quality time with their families on their days off. Thank you for your understanding and we look forward to seeing you at the class.Class Description:Introducing ""The Hairstylist Hustle"" - a unique class designed to help hairstylists become faster behind the chair, grow their business, and cultivate a strong vision for their career. Led by renowned stylist and educator Gina Bianca (@iamginabianca), this one-of-a-kind experience is 80% business, mindset, marketing, and strategy, and 20% hair. Whether you're a new or seasoned stylist, salon owner, educator, assistant, or beauty school student, this class is perfect for anyone looking to make the most of their cosmetology license.This isn't your typical hair class. Instead, ""The Hairstylist Hustle"" is built to develop grit and serve ambitious hairstylists who want to maintain their passion and energy behind the chair. By attending this class, you'll learn how to make more money as a stylist and discover all the opportunities and strategies to maximize your time and elevate your life and business. Salon owners are encouraged to bring their entire team to the class, regardless of their business model, to see massive growth in their salon. Gina will be teaching this class in three different ways, depending on the location, but the business segment will remain consistent. By purchasing a ticket to ""The Hairstylist Hustle,"" you agree to the terms and conditions set forth by the organizers.In today's uncertain economic climate, fear around losing clients and the impact on your business can be overwhelming. But with Gina's education and guidance, you'll learn to cultivate a resilient mindset that will help you serve your clients at the highest level, even during difficult times. You'll also build lifetime loyalty and rock-solid client relationships that will keep your business thriving. Don't miss out on this opportunity to take your hairstyling career to the next level - sign up for ""The Hairstylist Hustle"" today!What You’ll LearnThis course is designed to provide you with a comprehensive education on the latest hairstyling techniques and business strategies. Here's what you'll learn:Hair:You'll learn Gina's new ""BIG BANK"" express foil placement technique, which focuses on delivering fast and efficient results for clients. You'll also learn about express block color placement and offering options for clients on a tight budget. You'll discover how to avoid over-foiling and root melting, as well as seamless blending techniques for foiliyage. You'll also learn how to triple your retail sales, integrate express services into your business, and upgrade your retouches to higher ticket prices. Hands on is available in Palm Harbor, Florida and Plantsville, CT.Business:In this section, you'll learn about the five key performance indicators for stylists, building, managing, and growing your clientele, setting clear, fair policies to protect your business, and the four main focuses of salon ownership. You'll also discover the ten revenue opportunities for educators, ways to eliminate no-shows and last-minute cancellations, reverse engineering your pricing, communicating a price increase, and getting your clients addicted to you. You'll learn how to work with your client's budget and time constraints, how to have clear, quick, and effective consultations, Gina's $25k/year upselling menu, and strategies to improve your work-life balance. Additionally, you'll learn how to market your services through existing guests and referrals, as well as social media strategies.Life Coaching Mega-Strategies:In this section, you'll learn how to cultivate a positive outlook, integrate abundance into your being, change your mindset to favor the outcomes you're seeking, develop patience, and learn to trust the process. You'll also learn how to let go and embrace change.Investing in ""The Hairstylist Hustle"" will be the best decision you can make for your career in 2023. You'll gain cutting-edge hairstyling techniques, essential business strategies, and life coaching strategies to help you thrive in your career. Don't miss out on this opportunity to take your hairstyling career to the next level!Other Details:We want to make sure you get the most out of ""The Hairstylist Hustle"" course, which is why we're excited to offer some extra benefits and details for our students:- Mastermind Members receive 20% off their ticket. Simply log in to access your code or check your email for more information.- Need coaching and support after class? Get 50% off The Network Mastermind Platinum at check out and gain access after class! Follow this link for more information: [insert link here].- As a student, you'll receive the FULL curriculum workbook, packed with resources, links to more education, discount codes, bonuses, and more to enhance your learning experience.- All you need to bring to class is yourself and an open mind!- IMPORTANT: If you have dietary restrictions, please take care of yourself and make sure you have everything you need to stay focused and have a great learning experience throughout the day.- Refund Policy: Tickets are non-refundable, but fully transferrable to another student.- In the event of a cancellation, you will be issued a full refund to your original payment method.- Group Rates: Group rates are available for 6 or more students. Email hello@thenetworksalon.com for the code.Be sure to follow us on social media for updates and more information: @iamginabianca @thenetworkmastermind. We can't wait to see you in class!Gina's Classes Leave a Lasting Impression: Hear From Her Students""I would come to every class with her if I could. Absolutely worth the investment.""“Class was incredible. Gina is warm and inviting without coming off as fake or condescending. She actually cares about the individuals attending her class. She is so excited to teach you the knowledge she knows and it shows.”""I would recommend her classes to every person in our industry. New and long time. 10/10 would take any class by you again and again.""“Immediately upon meeting her, there was a great sense that she cared and is a genuine, upfront, real person. She treats everyone there as we are all equals, and she wants to share to help make your life better. Best educational class I have seen in a long time.”""I have a new outlook walking back into my business this week and can't wait to see how the things she taught us help form my business and the stylists' businesses that joined me for her demo class! This was one of my favorite classes I've done in my career.""“The class was just as I imagined and so much more. She packs a punch and doesn't hold back when it comes to education. I walked out of class and felt so confident in the techniques + business information she taught us.”""Gina is amazing! She gives her all in teaching her classes. She’s incredibly educated not only with hair but business, which I had been looking for. She’s very nice and down to earth. I love Gina! She’s one of a kind.""“Gina is amazing! She gives her all in teaching her classes. She’s incredibly educated not only with hair but business, which I had been looking for. She’s very nice and down to earth. I love Gina! She’s one of a kind.”""Gina's class was informative, hilarious, and left me inspired and ready to face new challenges. I would highly recommend attending her Masterclass for information not only on how to do some awesome applications but also to grow your business and become a better business owner.""“Gina's class was informative, hilarious, and left me inspired and ready to face new challenges. I would highly recommend attending her Masterclass for information not only on how to do some awesome applications but also to grow your business and become a better business owner.”Bio:Gina Sicard (@iamginabianca) is an experienced and passionate member of the beauty industry. With over 14 years of experience, she has been sharing her knowledge as an educator for over 7 years, beginning with one-on-one training for her own assistants. Through hard work and dedication, she has built a successful 30-chair salon at The Network and has also gained a global following as an independent educator. Additionally, she holds the position of Global Director of Hair Color for Rusk Professional. Despite her accomplishments, Gina remains grounded and committed to helping others succeed. In addition to salon ownership and traveling as an educator, she shares her candid and humorous approach to education and empowerment through her podcast and Private Mastermind Group, offering guidance to anyone seeking to grow in the beauty industry and beyond."
https://www.eventbrite.com/e/alligator-lizards-in-the-air-integration-through-creative-expression-tickets-664937023537?aff=ebdssbdestsearch,https://www.eventbrite.com/o/the-berkeley-alembic-foundation-44559759063,"Creative expression is a way to integrate phenomenon and visions experienced in altered states of consciousness, whether they be meditative or entheogenic in nature. From the very first forms of mark-making to the caves of Lascaux to the works of Pablo Amaringo and Alex Grey, humanity has sought to understand our internal landscapes through visual expression. Alligator Lizards in the Air: Healing and Integration through Creative Expression, is a once a month chance to bring these experiences to life through two dimensional mark making.Art mediums from paint to colored pencils, crayons to markers, will be available for everyone to use along with paper and canvas. Krisztina Lazar will be your visionary guide in creativity and will help you realize your experience before your eyes. No art background needed for this class. All you need is an open mind and a willingness to explore. Krisztina Lazar is a visionary artist primarily working in oil paint, watercolor and drawing. She is a Mische Technique lineage holder, a mixture of oil and egg tempera painting invented during the Dutch Renaissance and revolutionized by modern master, Ernst Fuchs. This technique creates an opalescent under painting that the colors are then glazed over, rendering each painting out of light rather than shadow, bringing the images to life with fractal clarity. Utilizing this transformative style that she learned from visionary pioneer, Brigid Marlin, her current body of work explores painting a hybrid of Mische and Alla Prima to render hyperealistic sacred art. With these two techniques combined, Krisztina creates images of Pop Shamanism, portals and visions that speak to today’s cultural climate of the occult, magic, fantasy, psychedelics, meditation, pop, nostalgia, and the environment movement. Originally from Cleveland, OH, she completed her BFA at Carnegie Mellon University in 2004 and her MFA graduate degree in 2011 at the San Francisco Art Institute New Genres department.  Her paintings have been exhibited in group and solo shows throughout the United States and Europe, most notably at the H.R. Geiger museum in Gruyere, Switzerland. She teaches her unique styles of painting to many students in group and private settings. Her work has been featured in multiple articles, galleries and book publications.  She currently lives and works in Northern California."
https://www.eventbrite.com/e/6th-annual-stanford-maternal-and-child-health-research-institute-symposium-tickets-657047947097?aff=ebdssbdestsearch,https://www.eventbrite.com/o/stanford-mchri-15901553112,"Stanford Maternal & Child Health Research Institute SymposiumThis annual research symposium will bring together faculty, trainees, students, and postdocs to explore the latest developments and innovations in maternal and child health research. This year's Symposium will feature important discussions about climate induced change in maternal and child health, as well as an exploration of omics and data-rich research journeys.Join us at this in-person event on October 19 from 7:45am-3:40pm PST!As in previous years, the symposium will also feature abstracts and a poster hall from across the Stanford research community, a focused scientific session highlighting omics, and the researchers and scientists who are making an impact in the maternal and child health community. This event is free and open to all.For your information, a livestream of this year's event will not be provided. Instead, the sessions from this year's event will be posted on the MCHRI Symposium event website shortly after the event.Visit the symposium website.Hear from leading experts in climate induced health changes and learn how researchers are responding to this changing landscape:A keynote panel will feature:A﻿aron Bernstein, MD, MPHn, Incoming Director, National Center for Environmental Health at the CDC, Assistant Professor at Harvard Medical School, Pediatrician at Boston Children's HospitalThomas Luben, MSPH, PhD, Senior Epidemiologist at the Center for Public Health and Environmental Assessment, US Environmental Protection Agency (EPA)E﻿ran Bendavid, MD, MS, Associate Professor of Medicine (Primary Care and Population Health), Senior Fellow at the Woods Institute for the Environment and Stanford UniversityThey each will lend their expertise during panel discussions on how the changing global landscape effects mothers and adolescents. Join us in-person as we hear from leading experts on maternal and child health topics, including:Is PEDSnet right for you? Navigating the data-rich research journey at Stanford﻿O﻿mics and Maternal and Child Health﻿Groundbreaking Research from Rising Scientists (Early Career Investigators and Trainees)Learn more about speakers. Attend the poster session Oct. 19Posters from the maternal child research community will be featured and live moderation will be available during the Symposium on October 19! Register now to learn more about the latest research in maternal and child health from rising scientists.Visit the symposium website.************************************************************************For questions about the event, contact Neta Miller at netamiller@stanford.edu."
https://www.eventbrite.com/e/svbc-volunteer-for-free-bike-repair-and-safety-check-at-the-library-tickets-660905053807?aff=ebdssbdestsearch,https://www.eventbrite.com/o/silicon-valley-bicycle-coalition-volunteering-17135810858,"How it works: We're partnering with the Sunnyvale Public Library on their bike repair clinic for April. We'll be providing volunteer mechanics, ABC Quick Check training, and an info table to help connect folks to useful bicycling resources.We're scheduled to be on-site from 10:30 to 12:30, with a professional mechanic who works with the library on these events joining us part-way through. Expect to stick around until 1:00 or a little later to wrap up, answer some last questions and finish what we've started.V﻿olunteer Roles:Volunteer Bike Mechanics: Help us fix more bikes! Quickly diagnose bikes for clients who are waiting, do safety checks, repair bikes and teach their owners what to look for next time. We encourage you to talk to clients about what you are fixing and how as well as about the benefits of becoming an SVBC member -- SVBC is key for making biking safer, improving health, and solving climate change. All levels of experience are welcome. If you have your own tools, bike stand, and/or canopy, please bring them!  General Volunteers: Check folks in, keep an eye on progress, and tell them about some of the bike resources and advocacy opportunities in the area.  Help connect them to resources that will be useful for them and tell them about SVBC and Bike Sunnyvale, and the work we do (and they can be part of!) making biking safer, improving health, and fighting climate change.A﻿BC Quick Check trainer: Make sure everyone who's leaving knows how to check their bike over for safety before they go for a ride, and observe the check to catch anything our mechanics might have missed."
https://www.eventbrite.com/e/flood-futures-a-suisun-city-flood-walk-tickets-652343114817?aff=ebdssbdestsearch,https://www.eventbrite.com/o/greenbelt-alliance-5291137499,"G﻿reenbelt Alliance is celebrating 65 years of adventures.Sustainable Solano and Greenbelt Alliance will lead this interactive waterfront tour to  learn about the impacts of flooding, sea level rise, and stormwater management in Suisun City and the Bay Area.We will begin near the water behind the Suisun City Civic Center and walk for approximately two miles, while we discuss climate change impacts as well as potential adaptation measures to mitigate harm to the community and landscape. We will also see how the slough interacts with urban areas and learn about the surrounding ecology. Suisun City is a Greenbelt Alliance Resilience Hotspot. The Bay Area Resilience Hotspots initiative is a blueprint for where we must protect communities that stand to lose the most in the face of climate change in ways that co-benefit habitats, open spaces, biodiversity, recreation, and more. Stay tuned for the digital map release on June 26th. Learn about Suisun City and our Bay Area Resilience Hotspots initiative at greenbelt.org/hotspots. Learn more about Sustainable Solano at sustainablesolano.org.P﻿hoto of the Suisun Marsh by Karl NielsonTOTAL DISTANCEThis is an easy,  mostly level walk of 2-3 miles round trip. LEADERSSadie Wilson (Greenbelt Alliance), Nate Huntington, (Greenbelt Alliance), Alex  Lunine (Sustainable Solano)WEATHER POLICY Outing goes rain or shine.COSTFree; RSVP required.WHERE TO MEETOur meeting location is the water behind the Suisun City Civic Center.  Parking is available on the south side of the Civic Center with charging for electric vehicles. To get there (from Interstate 80), take CA-12 E to Civic Center Blvd in Suisun City. Take exit 58B from CA-12 E and follow Civic Center Blvd for .3 miles until you reach the destination on the right.For those that hope to take public transit, the start of the walk is a half-mile from the Fairfield/Suisun Amtrak station. NOTESBring water, snacks, dress in layers with sun protection, and wear good walking  shoes.  Questions?  Contact Sadie Wilson at swilson@greenbelt.org or Nate Huntington at nhuntington@greenbelt.org.About the Outing LeadersLearn about Sadie Wilson here: Greenbelt Alliance TeamLearn about Nate Huntington here: Greenbelt Alliance TeamL﻿earn about Sustainable Solano  here: Sustainable Solano Team"
https://www.eventbrite.com/e/silicon-valley-bike-summit-2023-tickets-591754883787?aff=ebdssbdestsearch,https://www.eventbrite.com/o/silicon-valley-bicycle-coalition-21763925459,"13th Annual Silicon Valley Bike SummitConnect with insights and expertise at Silicon Valley’s largest gathering of active transportation leaders and organizers from government, the private sector, non-profits, and the general public. This is THE most information rich event of the year for bicycle professionals, elected and appointed officials, and citizen advocates in and around Silicon Valley.Date: Aug 24th - 8:30am to 6:00pmRegistration:Early Bird Registration: $40 ends on 7/24/23Regular registration: $50 open from 7/25/23 and closes on 8/24/23* All attendees will receive an SVBC membership for signing up to attend the Summit.** Scholarships are available for those to whom the cost of admission is prohibitive; please contact sandhya@bikesiliconvalley.org to apply.Getting there:1.4 miles from the Mountain View Caltrain Station . There will be a bike pool starting from the MV Caltrain station to the community center. Stay tuned for details.Tentative Timeline below:08:30am: Registration and breakfast (Valet Bike Parking will be available)09:30am: Welcome and Keynote/Plenary11:30am: Morning Breakout Sessions12:45pm: Lunch02:00pm: Afternoon breakout sessions03:30pm: Summit Awards04:00pm: Rapid-fire and Wrap-up05:00pm: Happy HourS﻿tay tuned for detailed program.All Summit registrants get one year of free SVBC membership! Covid SafetyThe safety of our attendees is a top priority and we will be following county guidelines throughout the Summit. We'll be opening up all the doors to the Redwood Room during breakfast, lunch, and happy hour. Attendees will have the option of eating and socializing at the tables indoors or outdoors. There will be plenty of space to socially distance.Many thanks to all of this year's Bike Summit sponsorsM﻿any thanks to our  Bike Summit Sponsors!"
