event-href,organizer_link-href,full_description
https://www.eventbrite.com/e/earth-day-marin-2024-tickets-645922189657?aff=ebdssbdestsearch,https://www.eventbrite.com/o/greenchangenet-25684561133,"Join the fun at Earth Day Marin 2024, next year's environmental festival on Sunday, April 21, 2024, from 1 to 5pm, at the Mill Valley Community Center in Marin County. Earth Day Marin is a free, family-friendly event featuring fun activities, art, music, youth and exhibits about climate action in a beautiful outdoor setting. We expect this to be Marin’s largest Earth Day event!We expect over 75 environmental booths and activities hosted by green businesses and community groups, who will help participants build a more just and sustainable world. Visitors of all ages and backgrounds will learn about climate actions such as: using clean energy, riding electric vehicles, eating well, living lightly, and building healthy communities.  REGISTER HERE TO GET YOUR FREE TICKETS. Earth Day Marin is hosted by Green Change, our nonprofit climate action network, with Mill Valley Recreation, and many more partners from across Marin and the Bay Area.Watch our video trailer above for a preview of what Earth Day Marin 2024 will be like.Featured AttractionsNext year’s Earth Day Marin 2024 promises to be bigger and better than ever, with a wide range of featured attractions including fun activities, green booths, evs and ebikes, live music, art exhibit and a youth zone!Join the fun and come celebrate Earth Day with family, friends and neighbors.To learn more, visit our Earth Day Marin page.  Volunteer at Earth Day Marin!Would you like to volunteer at our free community event? There are many ways you can help before, during and after the event.SIGN UP HERE TO VOLUNTEER.You will be invited to join one of our event teams: set up, welcome, clean up, activities, art, food, games, stage, management, multimedia, promotion and youth.After you fill your form, we will reach out to help you find just the right role -- and confirm your assignment. Earth Day Marin 2024 is organized by an all-volunteer nonprofit with limited resources. Our free events are made possible by generous friends and neighbors like you. Join our volunteer team, and help create a better world!Thanks for giving us a hand, if you can. Thanks to our partnersHere are some of the partners who exhibited and/or sponsored this year's Earth Day Marin 2023:Active Mill Valley • Art Works for Change • Autistry Studios • Bay Area Air Quality Management District • Bellows Service • Bye Bye Mattress • California Sunlight • City of Mill Valley • Climate Reality Bay Area • County of Marin • Creekside Pizza & Taproom • Equator Coffees • Friends of Alto Tunnel • Good Earth Natural Foods • Green Change • Harvest Thermal • John Owens Services • Mad Dogs & Englishmen • Marin Citizens’ Climate Lobby • Marin City Climate Resilience • Marin Community Foundation  • Marin County Bicycle Coalition • Marin County Sustainability Team • Marin Water • MCE Clean Energy • Mill Valley Emergency Preparedness Commission • Mill Valley Recreation • Mill Valley Refuse Service • Mill Valley Seniors for Peace • Mill Valley StreamKeepers • OFA Marin • Organic Cleaning Supreme • Outdoor Art Club • Pact • Play Marin • QuitCarbon  • Resilient Neighborhoods • Rex Foundation • Ride and Drive Clean • Straus Family Creamery • Surfrider Foundation • Sustainable Marin • Sustainable Mill Valley • Sustainable San Rafael • 350 Marin • Transportation Authority of Marin • Vitality Bowls • Wastewater Treatment Agencies of Marin • WTB-TAM • World Wrapps  • YardSmartMarin • Youth Action Through Art – and  more partners from across Marin and the Bay Area. We're grateful to  all our partners for making our Earth Day Marin events possible!I﻿f you have any questions, please email us at team@greenchange.net .We hope to see you on Earth Day next year!Poster art by Stuart Sharpe. Video trailer by Kevin Morrison , shot by  Omar Alami, Anita Baker, Griffith Ballard, Stuart Bass, Lee Callister, Fabrice Florin, Liam Keane, Gil Latimer, Tobey Ling-Winick, Tim Požar and Michael Wanger."
https://www.eventbrite.com/e/underbelly-the-art-of-slowing-down-tickets-665456928587?aff=ebdssbdestsearch,https://www.eventbrite.com/o/the-berkeley-alembic-foundation-44559759063,"Underbelly is a non-verbal somatic practice (freeform movement meditation) where we reclaim our slow in a fast and overwhelming world.  Our dominant culture survives on speed, which keeps problematic and oppressive structures in place at the devastating cost of our well-being and planetary health. Underbelly is a somatic response to the loss of slowness in an increasingly urgent world drowning in climate collapse, AI threat, technological addiction, diseased capitalism and polarization, as well as historical nervous system trauma from continuing racism, colonialism, and patriarchy. It’s time to dismantle the hurry and be in conversation with the present moment.This practice helps us explore the art of slowing down with ourselves, each other, and our current environment. There is space to metabolize our emotions, strengthen empathy and intuition, and develop an intimate relationship with our bodies and nature. We practice being in the questions themselves- listening and yielding to the intelligence of life without pushing, controlling, or fixing. Our individuation and togetherness are felt in a group field—deepening our presence and attunement with one another, co-regulating our nervous systems, being witnessed, held, considered, and noticed exactly as we are. We meet ourselves AS IS, without reaching for more or escaping/transcending reality.  We re-learn what it is to be relational instead of transactional.  To commune instead of consume. To be of service instead of self-serving. To rest back into the vastness and wildness of the natural world, releasing the tight circuits of programming, conditioning, and linearity we've known for so long.  Spend quality time with your body, breath, and being. Voyage beneath the surface of our fast culture, and dive into a slow sanctuary for unearthing what is alive, tender, and honest for you in every moment.​ This experience is not a solution, method, workshop or teaching of tools. It is not a business, ceremony, ecstatic dance, or dance class. It is a somatic gathering space that supports nervous system co-regulation, ample rest, and radical self/community care. About the Creator:Amy Rogg (she/her) is an activator and nurturer of the human spirit. She is half Taiwanese/half Jewish, born in Denver Colorado and raised mostly in the Bay Area. She is the conduit, creator, and facilitator of Underbelly: The Art of Slowing Down. Amy has a B.A. in television/film production and studied acting/improv in Los Angeles. She has also taught yoga (E-RYT 500), meditation, and somatic/relational movement for the past decade. Some of her inspirations: nature, GAGA, Hakomi, Continuum, The Artist's Way, Yat Malmgren, Contact Improvisation, Movement Liberation, Anna Halprin, Esther Perel, Elizabeth Gilbert, Resmaa Menakem, Sarah Blondin, Marc-André Leclerc, Jeong Kwan, Qi Gong, Yoga, Open Floor, Ecstatic Dance, Dancing Freedom, 5 Rhythms, Soul Motion, her mom, and romantic relationships. You can find her on instagram: @amyrogg"
https://www.eventbrite.com/e/reeve-wines-dinner-tickets-652278030147?aff=ebdssbdestsearch,https://www.eventbrite.com/o/the-village-bakery-15495330319,"Launched by winemaker Noah Dorrance in 2015, Reeve Wines celebrates California’s top cool-climate vineyard sites in Anderson Valley and Sonoma Coast. Noah, who co-founded Banshee Wines, brings over 18 years of experience to the project.  Working with noted single-vineyard sites, such as the Charles Heintz and Rice-Spivak vineyards, Reeve builds on a storied pedigree of chardonnay and pinot noir in the North Coast. We invite you to join us as Noah leads us through a broad selection of Reeve wines alongside a special menu. MENUReceptionGrenache Rosé, Remy Saves the Sea, Mendocino County 2021 ~K&J Orchards Peach and Cucumber SaladCouscous, Feta, MintRiesling, Vonarberg, Anderson Valley 2021 ~Roasted Corn FlatbreadGrilled Onion, Heirloom Tomatoes, Crème FraîcheChardonnay, Charles Heintz Vineyard, Sonoma Coast 2021  ~Rancho Llano Seco PorchettaAnson Mills Polenta, ChimichurriPinot Noir, Rice-Spivak Vineyard, Sonoma Coast 2021Pinot Noir, Ya Moon, Vecino Vineyard, Mendocino County 2022 ~Artisanal CheeseSeasonal AccompanimentsProprietary Red Blend, Libertine No. 7, Sonoma County*Cancellation policy: Up to 7 days before the event starts. Any cancellations after that will be issued in the form of a gift certificate."
https://www.eventbrite.com/e/tidal-treasures-foraging-for-seaweed-sf-tickets-595062236167?aff=ebdssbdestsearch,https://www.eventbrite.com/o/wild-awake-41935386153,"At low tide, the ocean pulls back to reveal an underwater forest – feather boa kelp floating in verdant pools, little rockweed sprouting from the sand, and on the underside of rocks, the twisted braids of black pine seaweed. With nearly 12,000 kinds of seaweed in the ocean, algae are responsible for most of the oxygen we breathe, serve as carbon sinks, and are a nutrient-rich superfood.By activating our sense of taste, touch, and smell, naturalist Tanya Stiller will guide us in ethically harvesting and protecting the regenerative power of seaweed on a well-kept secret of a beach, just under the Golden Gate Bridge. After filling our buckets to the brim, we’ll learn creative ways to use our foraged seaweed in cooking and skincare alike!Through reciprocal foraging practices, we’ll collectively explore:how to ethically identify, harvest, and protect a diversity of seaweeds  🍙seaweed’s benefits for the climate and its medicinal uses in food and skincare 🌍our relationship with the rhythm and cadence of ocean tides, the moon, the seasons, time, and seashore ecology 🌝N﻿ote: This workshop starts early to ensure we are able to see a diversity of seaweeds at negative tide.About the NaturalistTanya Stiller has been teaching for over 25 years as a clinical herbalist, nutrition consultant, gardener, permaculturalist, and ethnobotanist. She received her Botanical Medicine certificate in 1994 from The Oregon School of Herbal Medicine, ran a tincture and lotion-making company called Pixie Plants and has since been teaching herbal and foraging classes in Oregon and the Bay Area. You can finding her teaching classes on botany, seaweed harvesting, foraging, and homesteading at Ancestral Apothecary, and many Bay Area Herbal Schools.What's IncludedA cozy cup of tea & seaweed treatsZiplocks & markers for organizing your gathered seaweedWhat to BringComfortable clothing for spending time outdoors, such as a jacket, hat, warm socks, etc.Shoes you don’t mind getting wet (preferably close-toed!) with wool socksA bucket or container for collecting seaweedMesh bags for rinsing (i.e. re-used potato sacks, orange bags)ScissorsW﻿orkshop Pricing*By all of us contributing what we can afford, make this experience accessible for a diversity of incomes. The range reflects the disparity between economic conditions in the Bay Area, and is designed for those with more wealth to cover some of the costs of those with less access to wealth. Thank you for giving as much as you are able so that people of different economic backgrounds are able to join our programming.As you decide what amount to pay, we ask that you not only consider your present-day financial situation governed by income but also factors including historical discrimination faced by your peoples, your current financial wealth, your access to income and financial wealth, people counting on your financial livelihood, and the socio-economic conditions of your locale.Partner: $85Supporter: $75Friend: $65*Adapted from Dr. Bayo Akomolafe’s We Will Dance with Mountains: Into the Cracks Slow Study course with For The Wild.Covid-19 SafetyProof of full vaccination is required. Social distancing will be observed. Please do not attend if you are not feeling well, have COVID-19 symptoms, or have been in close contact with anyone who is COVID-19+.TransportationIf possible, we request that you walk, bike, or use public transportation to this event to reduce your carbon output. 😊 / Closest Bus Line: 28About Wild AwakeWild Awake curates immersive outdoor learning experiences that are rooted in connecting with and caring for ourselves, each other, and the more-than-human world.We believe that when we re-orient our attention to the time and space around us, we can cultivate relationships that recognize our mutuality and interdependence.For more details about Wild Awake, please visit www.wildawake.us."
https://www.eventbrite.com/e/barbara-lee-road-to-the-senate-2024-tickets-630397745627?aff=ebdssbdestsearch,https://www.eventbrite.com/o/the-commonwealth-club-2745603626,"Nationally, Democratic Rep. Barbara Lee is perhaps best known for being the only member of Congress to vote against war authorization after the Sept. 11 attacks, a decision that led to death threats and hate mail. But her willingness to take tough, progressive stands has endeared her to East Bay voters—who have re-elected her 13 times—and liberal Democrats across the country.Now, Lee is running to fill retiring California Sen. Dianne Feinstein’s seat. “We have to ease the burden on the middle class. We have to find a solution to poverty and homelessness. We have to take on the climate crisis. And we have to stop these MAGA extremists who think they can control people’s bodies and dismantle our democracy,” she said when announcing her candidacy. If she succeeds, Lee would be the sole Black female senator and only the third in U.S. history.Lee returns to The Commonwealth Club as part of our “Race to the Senate 2024” series of candidate forums. Come meet the candidate in person before you cast your vote for California’s next U.S. senator. 5:30 p.m. doors open & check-in, 6–7 p.m. program (all times PDT)No large bags or backpacks please. All bags may be subject to search.A﻿dditional information: https://www.commonwealthclub.org/events/2023-08-14/barbara-lee-road-senate-2024"
https://www.eventbrite.com/e/stanford-flame-ai-workshop-2023-tickets-593756701277?aff=ebdssbdestsearch,https://www.eventbrite.com/o/prof-matthias-ihme-and-wai-tong-chung-62889686633,"Mission To foster a dynamic forum for exchanging ideas, data, methods, and models related to ML techniques for combustion, turbulence, and fluid dynamics - fields crucial to the development of energy, propulsion, climate, and safety systems. Agenda 1. Lectures and talks will be given by AI/ML experts within Stanford and industry partners from the Greater Silicon Valley area.2. Practical exercises* and tutorial sessions will be held to tackle generative modeling challenges in combustion, turbulence, and fluid dynamics.* The outcomes of these practical exercises will be compiled towards a collaborative publication.T﻿opics(i) Fundamentals of data-driven tools, (ii) Generative ML, (iii) Physics-informed ML, and (iv) Benchmarking AI for Science.Eligibility CriteriaWe invite Combustion, Fluid dynamics, Computational, or AI/ML researchers worldwide to join us at this virtual/hybrid workshop.D﻿atesL﻿ate summer 2023W﻿ebsite (for info on dates and technical program)https://flame-ai-workshop.github.io/C﻿ontact us atf﻿lame.ai.workshop@gmail.com"
https://www.eventbrite.com/e/pitch-to-cvcsvcsangels-at-3rd-cvc-summit-during-tcsfpermitcenter-tickets-651717132487?aff=ebdssbdestsearch,https://www.eventbrite.com/o/pitch-global-14550045321,"Above is the picture of the City and County of San Francisco's Permit Center, where our 3rd Corporate, Govt & Impact Summit will be co-hosted by Alliance Indus, Indus Setu, Pitch Global etc.We recently hosted Pitch Global CVC, Govt & Impact Summit as a part of our outreach on behalf of Norcal SBDC funded through California Governor's Office of Economic Development and Small Business Administration to CVCs and other investors who are investing in Silicon Valley in startups which can create Economic Impact and jobs.Watch footage video from our previous Conference featuring the Head of Samsung Catalyst Fund, Korea's SK Group ( Cali Gov's Office gave them an award on our behalf for committing to President Biden to invest $ 59 b), TDK, IBM, Schlumberger, 3M, Lam Research Cap and others along with opening keynotes by Norcal Head of Gobiz, Ca Gov's Office of Economic Development & SJSU Innovation officials. https://youtu.be/2dfh9It91ScPitch Global is Silicon Valley's leading network of investors from reputed/brand name firms where you will meet senior investors/decision makers from firms who are household names, like Stanford Angels, MIT Angels, Harvard Angels, Caltech Angels,  Keiretsu Forum, J&J, NGK (investing $ 1 b+ in Health Tech), Lam Research Cap($ 1 b), SK Group (investing $ 59 b),   IBM, Samsung Catalyst, Hitachi, Qualcomm, Verizon etc . The Summit provides entrepreneurs an opportunity to connect with reputed  Corporate Venture Capitalists (CVCs), VCs, angel investors, and policymakers from local, federal, and emerging market governments and embassy representatives.Previous participants include IBM, Samsung, HP, SK, TDK, Micron, Shell, Jetblue, NGK, Schlumberger, 3M, and Lam Research. 2023 will see some of them return in addition to new ones like J&J, Hitachi, Qualcomm, SRI, Saint Gobain, and others. The agenda will include ""pop-up"" Q&As and fireside chats wherein they share their investment thesis.*PROPOSED* AGENDA08.30 am - 09:00 am: Registration. Hall 1 & Hall 2.HALL 1AMBASSADOR KEYNOTE09:00am - 09.20am: Q&A style keynote by Ambassador and renowned entrepreneur or investor.09.20am - 09.35am: Speech by prominent India policymaker09.35am - 09.50am: Speech by Congressman from California.LIFESCIENCES SESSION09.50am - 10.30am: Life Sciences Investors and Fireside Chat.10.30am - 11.30am: Life Sciences companies presenting.CLEAN ENERGY, CLIMATE TECH, EV11.30am - 12:10pm: Clean Energy & Climate Tech Investor Fireside Chat.12.10 pm - 12:40pm: Climate Tech cos Presenting.12.40 pm - 01.30pm: Lunch break and Networking.LUNCHEDUCATION AND EDTECH01.30pm - 02:00pm: Edtech Fireside Chat. Hall 1.WOMEN ENTREPRENEURS02:00pm - 03:00pm: Diversity Funding / Fireside chat - Women Entrepreneur Track.DIVERSITY FUNDING03:00pm - 04:00pm: Diversity Funding / Fireside chat - Black Entrepreneur Track.____________________________________HALL 2 (A&B Rooms)Room A : ALL DAY STARTUPS DEMO ROOMRoom B : STARTUP DEMO ROOMS SETUP08:30am-09:15amSTARTUPS DEMO SESSIONS09:15-01:35pmCORPORATE VENTURE CAPITAL (CVC) in Deep Tech, AI and other related areas.01.35pm - 01.50pm: Q&A keynote with leading CVC from Qualcomm Ventures01.50pm - 2:05pm: Q&A keynote with leading CVC from Hitachi Ventures.STARTUPS & FOUNDERS PRESENTATIONS02.05pm - 03.35pm: Technology Founders presenting to investors.CLOSING KEYNOTE.03.35pm - 04:00pm: Closing keynote. TBD.AWARD CEREMONY04:00pm - 04:15pm: Award ceremony of giving Platinum Impact Award toRecipient : David ""Dede""Goldschmidt, Global Head of Samsung Fund & Closing remarks.Refund Policy: Credit may be provided for a future event at the discretion of the organizerAny questions please write to: startups@pitchglobal.comPitch Global is an affiliate partner of the TFG SBDCD﻿isclaimer: NorCal SBDC Is funded in part through a cooperative agreement with the US Small Business Administration (SBA). Funded in part through a grant with the Funded in part through a Grant with the California Office of the Small Business Advocate (GO-Biz). All opinions, conclusions, or recommendations expressed are those of the author(s) and do not necessarily reflect the views of the SBA, Go-Biz, SJSU, PitchGlobal, or Cal Poly Humboldt-sponsored programs."
https://www.eventbrite.com/e/the-crucible-an-alchemical-exhibition-of-local-artists-tickets-662027099877?aff=ebdssbdestsearch,https://www.eventbrite.com/o/the-berkeley-alembic-foundation-44559759063,"E﻿vent is from 5:00-9:00pm with a Curator Talk at 7pmThe Crucible Curator’s StatementThe Alchemist’s Crucible can withstand extreme heat, holding strong in the billowing fires as the metals inside become molten. This essential alchemical tool is  a metaphor for the vessels  in life and in ourselves that contains the fires of transformation and can withstand their intense heat. Much like the phoenix submitting itself to the fire to be reborn, there is a pinnacle of intensity where everything within us is tested. Surrounded by the extreme heat, things snap  into focus. Will the vessel hold? Or will it shatter? The artworks included in this show embody this moment of pressure-testing in a variety of ways. When we examine the times in our own lives when we  submit our emotions, our senses, and our very being to the raging fires of change , the question of  whether or not we can take any more can flip to new resolve, clarity, and strength. Our vessel, our container, and our body bear witness to these moments when the heat is so intense that the  metal of our inner resolve becomes molten and we are able to  transform difficulty into determination, flow, and movement. Each piece in “The Crucible”  speaks to this magical process, whether as the vessel, the fire, or the metal within. C﻿urated by Krisztina LazarKrisztina Lazar is a visionary artist primarily working in oil paint, watercolor and drawing. She is a Mische Technique lineage holder, a mixture of oil and egg tempera painting invented during the Dutch Renaissance and revolutionized by modern master, Ernst Fuchs. This technique creates an opalescent under painting that the colors are then glazed over, rendering each painting out of light rather than shadow, bringing the images to life with fractal clarity. Utilizing this transformative style that she learned from visionary pioneer, Brigid Marlin, her current body of work explores painting a hybrid of Mische and Alla Prima to render hyperealistic sacred art. With these two techniques combined, Krisztina creates images of Pop Shamanism, portals and visions that speak to today’s cultural climate of the occult, magic, fantasy, psychedelics, meditation, pop, nostalgia, and the environment movement. Originally from Cleveland, OH, she completed her BFA at Carnegie Mellon University in 2004 and her MFA graduate degree in 2011 at the San Francisco Art Institute New Genres department.  Her paintings have been exhibited in group and solo shows throughout the United States and Europe, most notably at the H.R. Geiger museum in Gruyere, Switzerland. She teaches her unique styles of painting to many students in group and private settings. Her work has been featured in multiple articles, galleries and book publications.  She currently lives and works in Northern California.V﻿olunteer to help with this event Volunteer Here  ArtistsLarraine SeidenBells HowardGage OlesenChris IsnerJennifer RobertsThailan WhenYabette SwankQuinn KeckKathryn BarronHeather Chou SontagTim ArmstrongMay M. LoWendy Ackrell Cat LavigneNatalia RiverosKayla Van KollMichael David Larson lKrystal KoopLisa NowlainBenjamin A. VierlingLibaMary Lawrence/ Evolve with MaryAuguste Fallon"
