event-href,organizer_link-href,full_description
https://www.eventbrite.nl/e/tickets-floatation-tank-book-your-session-630876337107?aff=ebdssbdestsearch,https://www.eventbrite.nl/o/west-den-haag-8971175698,"‘In the province of the mind, in the inside reality, what one believes to be true, either is true or becomes true within certain limits. These limits are to be discovered experientially and experimentally. When so determined these limits are found to be further beliefs to be transcended.’*As part of the exhibition Gödel Escher Bach, we are proud to offer visitors the opportunity to personally experience John C. Lilly's tank isolation technique. The original concept was devised by John Lilly as a research instrument in 1954. In the ensuing decades, Lilly would go on to simplify and perfect the solitude, isolation and confinement tank, making it safer to build and use even for those untrained in this kind of research. The floatation tank that is available for visitors to use was inspired by Lilly's original tank designs. The floatation tank is a medium for process. It removes 99% of sensory input sources, assisting the user in cultivating an awareness of their internal state of being and attuning to their senses within and without the tank. Similar to meditation, many people enter into a relationship with sensory deprivation practices with certain expectations about what is going to happen. 'All we can say to these people is — nothing will happen that you don’t already know about; nothing can happen that you will not allow to happen, i.e.: “What is forbidden is not allowed.”' The possibilities for application of the tank isolation technique are multiple, ranging from simple relaxation in the weightlessness of the salt solution, pain relief for individuals suffering from neurodegenerative diseases, and psychonautic exploration of consciousness, with many certainly yet to be discovered. The relative lack of contemporary awareness of and research into sensory deprivation is partially due to the inaccessibility of the medium to the public. Floatation centres are scarce and expensive. Especially centres that endeavour to create an environment conducive to exploration, experimentation and reflection are lacking. West hopes to become such an environment throughout the exhibition of the floatation tank, providing an (albeit temporary) embryonic escape through sensory deprivation from life in a cultural climate characterised by flagrant overstimulation. An impossible space for self-interrogation of The Deep Self. * John C. Lilly (1915-2001), The Deep Self: Profound Relaxation and the Tank Isolation Technique, 1977, (Distributor).What to consider before booking a timeslot You will be in an enclosed space in the absence of light and sound for +/- 1 hour, so if you are claustrophobic or fear the dark this is something to consider. However, as there is no light influx whatsoever in the tank, the inside appears more spacious to the user than it is in reality. This often negates feelings of claustrophobia. Even if you are claustrophobic, please feel free to come give it a try. Your session can be stopped at any time if you feel uncomfortable for any reason. You will be suspended in a solution of Water, Magnesium Sulfate, and Hydrogen peroxide (<100ppm), and Sodium Citrate, maintained around 33-34 degrees Celsius (skin temperature). The solution has a neutral pH, compatible with that of human skin. The solution is filtered and treated between each user.However, if any of the following apply to you, we recommend you do not participate in this installation:You have open wounds anywhere on your body. This includes conditions such as scalp eczema, skin ulcers or athlete’s foot. This if for your own wellbeing (seeing as the highly dense salt solution will sting quite a bit on open or irritated skin) and for the wellbeing of subsequent users of the floatation tank. The same naturally applies to any other infectious diseases.You are currently menstruating, are easily susceptible to urinary tract infections, or are in the process of healing from gender-affirming surgery. If you are pregnant, please consult your physician before booking a session.You suffer from diarrhoea or gastroenteritis/are living with bladder or bowel incontinence.You have low blood pressure.You are epileptic.You are diagnosed with an acute psychological/psychiatric condition. Please consult your respective mental health professional here, do your research and use your best judgement.Any questions about particular conditions’ compatibility (such as specific physical disabilities) with floatation therapy can be directed towards the contact listed at the end of this information sheet. We strongly discourage any visitors from entering the tank under the influence of any and all mind-altering substances (excluding prescription medications taken under the supervision of a medical professional). If the host is under the impression that you are in any way inebriated you will not be allowed inside the tank and your participation fee will not be refunded. The risks of this far outweigh whatever rewards you might have read about. The tank is wheelchair accessible. Please be advised that you will be required to sign a liability waiver before entering the tank.  For more information, please contact us: kevin@westdenhaag.nlWhat to bringTowelFreshly washed bathing suit (optional)Slippers Bathrobe (optional)Shampoo and hairbrush (if you have long hair)Sunglasses for your way home (advisable)"
https://www.eventbrite.nl/e/an-apocalyptic-soundtrack-of-the-city-tickets-619825724427?aff=ebdssbdestsearch,https://www.eventbrite.nl/o/nieuwe-instituut-8317002316,"Rosi Braidotti and Shay Kreuger explore how music has been used to articulate our desires and emotions on the way to the apocalypse. With special guest Extinction Rebellion.From David Bowie to Prince, and Billie Eilish to Doe Maar: the end of the world has been sung for decades already. Rosi Braidotti and Shay Kreuger continue their series of talks on how music allows us to express our desires and perceptions of the world and help us come to face with our fears. The end of the world (or ’the apocalypse’) is no exception. If the world does have to end, then let's at least go down dancing.Joining their conversation is the international activist movement Extinction Rebellion who voice their deep concerns for the climate and ecological crisis, and fight for a livable and just planet.P﻿rogramme19:15 hr: Doors open at the Auditorium19:30 hr: Introduction by Francien van Westerner19:35 hr: Lecture by Rosi Braidotti19:50 hr: Conversation with Rosi Braidotti and Shay Kreuger20:25 hr: Conversation with Extinction Rebellion and Shay Kreuger20:40 hr: Conversation with all speakers and Q&AI﻿mage credit: Aad Hoogendoorn, Nieuwe Instituut"
https://www.eventbrite.nl/e/gtgc-conference-roundtable-local-action-for-global-change-in-the-hague-tickets-628537652037?aff=ebdssbdestsearch,https://www.eventbrite.nl/o/the-hague-humanity-hub-16890919535,"The Hague, the International City of Peace and Justice, is not only a major hub of embassies, international organizations, and NGOs, but also a hive of grassroots activism on global issues. Bottom-up social movements engage global questions around culture, environment, food security, human rights, refugees, and more. This special event brings together conveners of local movements for global change to exchange experiences of mobilizing citizens around global challenges. What works (and what doesn’t)? Join us at the Hague Humanity Hub on Friday, 9 June 2023 @ 1030-1330 for a plenary round table, small group discussions, and a networking lunch to learn about possibilities and challenges in local action for global change.T﻿he speakers for this event are:T﻿om Marshall:Tom believes that work should help you thrive as a human being while making the world a better place. He’s been active with Extinction Rebellion since 2019; focusing on training and growing the climate movement. Professionally, he uses the same skillset as a Workshop Facilitator & Coach for young professionals who are striving to create a more sustainable world. He previously worked as a strategy consultant at Deloitte, so acts as a bridge in shaking up business as usual.Maral Khajeh:Maral Khajeh is an Iranian/Dutch lawyer and peace advocate and has worked for the global pro-bono law firm Public International Law and Policy Group, the Erasmus Prize Foundation and Nonviolent Peaceforce South Sudan. She coordinated leadership & peace projects in North and East Africa. As she lived in Egypt and South Sudan, Maral worked closely with civil society. Through her work she always tries to connect Human Rights with Art. Maral currently works at The Hague-based human rights organisation Justice & Peace Netherlands as the Programme Coordinator of the global temporary relocation initiative for human rights defenders at risk, Shelter City. Arna van der Sloot:Arna deals with social issues in which society, the extreme extremes and prejudices within this society are central. She stands up for minorities, helps welcome people into society and offers them an opportunity to participate. She founded, Arna's Production House which is an innovative company and a creative partner when it comes to theatre, film or voice productions.--This event is a part of the Global Transformations and Governance Challenges Conference.	  GTGC is based in The Hague, a world centre of global governance as well as political capital of the Netherlands. The GTGC programme brings together scholars from different faculties at Leiden University, working in highly interdisciplinary teams."
https://www.eventbrite.nl/e/the-momo-spreads-love-movement-launchparty-registration-632855747577?aff=ebdssbdestsearch,https://www.eventbrite.nl/o/momo-education-by-sister-schools-foundation-65589886643,"MoMo Spreads Love Funding DinnerWe cordially invite you to attend the launch party of the 'MoMo Spreads Love Movement'. It will be an evening filled with entertainment, delicious food and drinks, and an opportunity to make a real difference in the lives of children worldwide. Our aim is to create a movement with 50 people who can contribute 50 euros per month till the end of the year. This will enable the foundation to set up 5 new schools with a digital classroom in the coming year. Don’t miss this chance to make a positive impact and be part of something very special.CAMPAGNEMomenteel is er nog plek voor een paar nieuwe Nederlandse scholen om in het schooljaar 2023/2024 van start te gaan,  zowel in het PO als VO. De zomer crowdfunding campagne start op vrijdag 16 juni, de VN dag van het Afrikaanse kind en eindigt op de Nelson Mandela Dag, dinsdag 18 juli. Midden in deze periode, wordt op maandag 3 juli de lancering van de ‘MoMo spreads Love Movement' gevierd in Amsterdam.De zusterscholen in Nederland ondersteunen hun Keniaanse partnerscholen door de jaarlijkse  ‘MoMo Spreads Love Winter Crowdfunding Actie’. Hiermee kunnen meer specifieke projecten worden bekostigd. Denk bijvoorbeeld aan een schoolbus, een waterput of schoolmeubilair of de aanschaf van meer computers, tablets etcetera.Het netwerk van donateurs, vormt samen met het vrijwilligersnetwerk van de stichting en het scholennetwerk, de lerende netwerkorganisatie Sister Schools.Alleen samen kunnen we de problemen oplossen en vandaar dat we de ‘MoMo Spreads Love Movement’  lanceren.MOMO EDUCATION BY SISTER SCHOOLS FOUNDATIONMoMo Education by Sister Schools Foundation (MoMo) is in 2021 opgericht door documentairemaker Julia Strijland.  MoMo is een digitaal onderwijsprogramma gericht op interculturele samenwerking tussen leerlingen van basis- en middelbare scholen aan weerszijde van de welvaarts balans. Het volledig programma bestaat uit 3 lesblokken van 6 weken per jaar gedurende 2 jaar. Er zijn uitwisselingsmomenten met de docenten voorafgaand aan ieder lesblok. De MoMo Educatie methode maakt gebruik van een veilige online leeromgeving, het Digital Educational Exchange Platform (DEEP). Hier komen de leerlingen samen, wisselen ze foto’s, video’s en ideeën uit en werken ze samen aan projecten, ter verbetering van hun eigen leeromgeving. MoMo stelt  het gezamenlijk belang van kansengelijkheid in het onderwijs voorop. Vanuit betrokkenheid bij dit belang wil MoMo een stuwende en vernieuwende kracht zijn, die bijdraagt aan een duurzame ontwikkeling van de leeromgeving van leerlingen. .Vanuit de gedachte ‘think global, act local’ worden scholen aangemoedigd om crowdfunding acties te houden, komen er campagnes rondom thema’s als ‘Digitale veiligheid’ en krijgen leerlingen een stem op thema’s die belangrijk voor hen zijn, zoals het klimaat, het recht op goed onderwijs en kansengelijkheid . Het overbruggen van verschillen en het communiceren over culturele en sociaal-economische verschillen heen kost tijd. Vandaar dat er een 2-jarig ‘learning by doing’ programma is opgezet, waardoor scholen een duurzame band met elkaar op kunnen bouwen en de relatie daadwerkelijk ondersteuning kan bieden aan de scholen in Kenia.---------MOMO EDUCATION BY SISTER SCHOOLS FOUNDATIONThe Sister Schools Foundation was founded in 2021 by Dutch documentary maker Julia Strijland. The idea of connecting schools on both sides of the wealth divide has been further developed together with Sarah Wanjira, a Kenyan computer teacher. The idea came about when Julia volunteered to teach teachers at a girls' school in Nairobi, St. Elizabeth. A school founded by Mary Mungai. She offers children from the slum an opportunity, shelter and education, which she was only allowed to follow until she was 13.The teachers of this school were very interested in the so-called '21st-century skills' and in digital education, but at the same time they sometimes could not pay the teachers' salaries and/or the children did not come to school because they could not pay for school fees. In short: the school is too poor to invest in digital education. The Kenyan government has introduced a new curriculum, the 'Competency Based Curriculum', which uses digital learning resources, but most schools are unable to offer digital education.That is why the Sister Schools Foundation has been set up in the Netherlands and a TRUST organization has been founded in Kenya. Wilde Ganzen (a Dutch NGO) has supported the Kenyan school projects and the DEEP Kenya Trust.The educational exchange is equivalent; On both ends, children can learn as much from each other. There is no difference. Based on the idea of 'think global, act local', schools are encouraged to hold crowdfunding campaigns, campaigns will be launched on themes such as 'Digital security' and pupils will be given a voice on themes that are important to them, such as the climate, the right to good education and equity. The MoMo Education method uses a secure online learning environment, the Digital Educational Exchange Platform (DEEP). This is where pupils come together, exchange photos, videos and ideas and collaborate on projects to improve their learning environment.Bridging differences and communicating across cultural and socio-economic differences takes time. That is why a 2-year 'learning by doing' program has been set up so that schools can build a lasting bond with each other and the relationship can provide support to the schools in Kenya.CAMPAIGNAfter the May holidays, the foundation starts a campaign to find new Dutch schools to partner with. There is currently room for 11 new schools, both primary (4) and secondary (7). In Kenya, the schools are working hard to get their digital and media skills levels to the right standard to be able to take part in the International exchange starting in September this year. The summer crowdfunding campaign starts officially on Friday, June 16th, the UN Day of the African Child and ends on Nelson Mandela Day, Tuesday, July 18th. In the middle of this period, the launch of the 'MoMo spreads Love Movement' will be celebrated on Monday. July 3rd in Amsterdam.The sister schools in the Netherlands support their Kenyan partner schools through the 'MoMo Spreads Love Winter Crowdfunding Action'. This can be used to fund more specific projects. Consider, for example, a school bus, a well or school furniture or the purchase of more computers, tablets, etc.MoMo SPREADS LOVE MOVEMENTThis network of donors, together with the volunteer network of the foundation and the school network, forms the learning network organization Sister Schools.Only together can we solve deep problems, such as giving access to quality education for all kids worldwide. Do you like to know more about the MoMo Spreads Love Movement? Click here. No sweepstakes, giveaways or promotions will be offered in exchange for donations to this GoFundMe campaign."
https://www.eventbrite.com/e/prometheus-problems-doing-good-check-your-charity-tickets-633206306107?aff=ebdssbdestsearch,https://www.eventbrite.com/o/studium-generale-tu-delft-28048008259,"""Impact for a better society"" is Delft University's strategic motto: we aim to overcome the challenges of our world through research into technological solutions as wells as policy and governance. But there are many more ways in which one can have a positive impact on society, for instance through social movement, activism and good old-fashioned charity.Charity knows many forms and flavours, and has itself been the topic of much debate and research. How do you achieve the best outcome? Do you trust large organisations to decide how to effectively spend your money, or do you simply hand out cash to individuals and let them spend it where they feel it is most needed?And who decides what the 'best outcome' is? The greatest good for the greatest number of people sounds like a sensible approach for impact on society. But do the needs of the many always outweigh the needs of the few, or are there other values and human rights at stake?Kritika Maheshwari is Assistant Professor in Ethics & Philosophy of Technology at the TPM Faculty of TU Delft. Kritika’s research interest and work lays at the intersection of moral and political philosophy of risk. She’s particularly interested in how societies ought to tackle and mitigate existential risks keeping future generations in mind.Eduard Nazarski was director of Amnesty International Netherlands from 2006 to 2020. He remains committed to  peace and human rights, and is currently president of the supervisory board of peace organisation PAX.Jan Wehner is currently in the second year of his master's degree in Computer Science, specialising in artificial intelligence. He is a founding member of both Effective Altruism Delft and the Delft AI Safety Initiative.Prometheus’ ProblemsAt this quarterly event, students, professors and external experts will exchange thoughts about philosophical and ethical themes related to engineering, modern technology and its impact on society. Importantly, the themes are based on questions put forward by students themselves. A discussion in a comfortable setting, with a drink at hand."
https://www.eventbrite.nl/e/an-evening-with-kunle-adeyemi-tickets-591729838877?aff=ebdssbdestsearch,https://www.eventbrite.nl/o/nieuwe-instituut-8317002316,"In this edition of An Evening With – a series of conversations with emerging and established voices from the design world – we welcome Kunlé Adeyemi. Together with the architect, we talk about his practice, inspirations and fascinations, and his new publication African Water Cities which will be launched this evening. This event is moderated by architect Aura Luz Melis.Kunlé Adeyemi was born in Nigeria and lives and works in the Netherlands. Together with his agency NLÉ, for the past decade he has been researching the relationship between cities and water, rising sea levels and housing shortages. He studies coastal African cities where rapid urbanisation and rising water levels are leading to major challenges and innovative solutions.During this evening, the publication African Water Cities is presented to the public for the first time. The publication presents research on African water cities and how they deal with the two most important trends of our time: urbanisation and climate change.Water Cities Rotterdam. By Kunlé Adeyemi.Opening on 14 May 2023, Adeyemi's impressive floating pavilions will be on display as part of the exhibition Water Cities Rotterdam. By Kunlé Adeyemi."
https://www.eventbrite.com/e/tickets-sinkit-quarterly-meeting-623016528207?aff=ebdssbdestsearch,https://www.eventbrite.com/o/sinkit-cooperative-64825714623,
